{
  "after_baseline_digest": "26ffcd551f4af8b9cacce4801cec54a3e9b619029be2e1f51cf36ee276d1d780",
  "after_digest": "a1dd2da54f4267823ac5eebfc9e8b6cc9ae64104c757b7d7b56e3a69f7733091",
  "before_baseline_digest": "26ffcd551f4af8b9cacce4801cec54a3e9b619029be2e1f51cf36ee276d1d780",
  "before_digest": "d4f0788fd9efb1b6c454740a7340d522f49b141249cfa0af101cc14012f0a2c8",
  "decided_by": "architecture maintainers",
  "rationale": "Bind the deliberate public CallBinding.proof declaration required by AD-244 to the exact prior contract and baseline; no budgets, permissions, or debt allowances change.",
  "schema_version": "2.0.0"
}
