{
  "after_baseline_digest": "927d1a4f4aba9d73b8e5e561969ad4fb553857f0054752dedefaee94780f0b2c",
  "after_digest": "4f809e2e488f7bc14fbfac4e9f20ea20f22a26a7f50cbe920ad2bd90fbdbb3b7",
  "before_baseline_digest": "927d1a4f4aba9d73b8e5e561969ad4fb553857f0054752dedefaee94780f0b2c",
  "before_digest": "775c71bd5e57dd5c8e7ea54d266542d4f255686db9e8135fd8b4fa6847a1b9db",
  "decided_by": "architecture maintainers",
  "rationale": "AD-250 adds bounded source facts for guarded paths and one-hop private helper binding, owned by the Python call collector and guarded-effect evaluator. Preserve the existing measurement budgets and record no increase in known debt.",
  "schema_version": "2.0.0"
}
