{
  "after_digest": "756f045fd383cbb3ea14e55ca6dac1656110ca7629247dc1a6a17987dfddb87e",
  "before_digest": "e8f19e8a08501f540fa4291e7cec272353cd0eb32108414162a9ca7c91c9950a",
  "decided_by": "architect",
  "rationale": "Keep three exact open-map signatures: arbitrary file paths and environment names are data, not fixed records; the analyzer now exposes them and preserves other findings.",
  "schema_version": "1.0.0"
}
