{
  "after_baseline_digest": "c0b9598584d4e6a3d38d5684fc612c22399c2dfa0a929b2ef29e611861c4d7e8",
  "after_digest": "998c92670661dc2b3837d690cc9e03b53e0a98e0ca6584ee7180e8798eaef3b9",
  "before_baseline_digest": "c0b9598584d4e6a3d38d5684fc612c22399c2dfa0a929b2ef29e611861c4d7e8",
  "before_digest": "d7d5c317c8d4fa127b2a4a8a5af3b66888592322f1c362eca81ccfc970f2baef",
  "decided_by": "architect",
  "rationale": "Expose the bounded source-reference context helper used by the analyzer to produce typed source-ownership reference facts.",
  "schema_version": "2.0.0"
}
